{
  "meta": {
    "schemaVersion": "1.0",
    "project": "shopdemo",
    "commit": "0000000000000000000000000000000000000000",
    "generatedAt": "2026-01-01T00:00:00Z",
    "profile": "balanced",
    "sources": [],
    "coverage": { "src": ["src/**"] }
  },
  "zones": [{ "id": "z-app", "kind": "service", "label": "Application" }],
  "nodes": [
    { "id": "n-shop", "zone": "z-app", "kind": "service", "title": "Shop service", "paths": ["src/**"], "level": 1, "evidence": [{ "path": "src/index.js", "lines": "1-5" }] },
    { "id": "n-auth", "zone": "z-app", "kind": "module", "title": "Auth module", "paths": ["src/auth/**"], "level": 2, "evidence": [{ "path": "src/auth/login.js", "lines": "1-9" }] },
    { "id": "n-db", "zone": "z-app", "kind": "module", "title": "Data access", "paths": ["src/db/**"], "level": 2, "evidence": [{ "path": "src/db/query.js", "lines": "1-9" }] },
    { "id": "n-docs", "zone": "z-app", "kind": "module", "title": "Operator guide", "paths": ["docs/guide.md"], "level": 2, "evidence": [{ "path": "docs/guide.md", "lines": "1-3" }] }
  ],
  "edges": [
    { "id": "e-shop-db", "from": "n-shop", "to": "n-db", "type": "call", "desc": "reads orders", "evidence": [{ "path": "src/index.js", "lines": "3" }], "confidence": "verified" }
  ],
  "entities": [
    { "id": "en-order", "store": "n-db", "name": "order", "kind": "table", "fields": [] }
  ],
  "sequences": []
}
